{
  "operation_id": "op_fixture",
  "workspace_id": "ws_fixture",
  "connection_id": "con_fixture",
  "action": "install_image",
  "status": "failed",
  "connection_revision": 1,
  "created_at": "2026-10-07T00:00:00Z",
  "updated_at": "2026-10-07T00:00:00Z",
  "problem": "image_installation_unknown",
  "replay": false
}
